"si Economic activities;i &amp;;e¢é;= Boos H 2 2 2 52;s € 8 2 2 € Bs;§ 8 &amp; 2 €;€ 2;&amp; 2 &amp;;8 s £ &amp;;5;2 § ¢ &amp;;3s 8 8 3 =e 8 8 3 8 # 3s gf € € &amp; 5;§ 2;§ 2 2&amp;;g @ &amp; € &amp;;2 § = &amp;;3 Ears $88 82s;Bs to: Bg §€5s ERS Fees;gos £ 42 g § 2 8
A. TAXONOMY-ELIGIBLE ACTIVITIES A.1 Environmentally sustainable activities (Taxonomy-aligned) (keuro) (0) GOWN GOY/N BNE) AURIR QUEER LECH YN YN YN YIN YM YM YM (HET
Electricity generation using solar photovoltaic technology;CCM;7.644;0.06;;N;NAL;NEL;NEL;;NEL;;oY;;YY;;YY;;YY;~(0%6;;
Electricity generation from wind power;CoMa.3;465,496;3.92;YN;;;NAL;WEL;WEL;;ONAL;;OY) OY);;OY;;OY;;YY;689;;
Infrastructure for rail transport;CCM6.14;304,699;2.57;YN;;;NAL;WEL;WEL;;;;ONLY OY;;OY;;OY;;UY;;UY;205;OE
Turnover of environmentally sustainable activities;;;0.00;0.00;000;ooo;oo;Y;Y;Y;Y;Y;YY;1020
Of which enabling;;;304,699;2.57;2.57;0.00;0.00;0.00;0.00;Y;Y;Y;Y;Y;Y;Y;Y;es;€E
Of which transitional;;;0;0.00;;;;yy;;yY;YY;YY;;YY;00;;
A.2 Taxonomy-eligible but not environmentally sustainable activities —;;;;;;;;;;;;;;;;;;;;;;;;;;;
(not Taxonomy-aligned activities) Manufacture of other low carbon technologies;;;11,226;0.10;;;;;;;;
Manufacture of hydrogen;CCM 3.10,CCA 3.10;1,090;0.01;EL;EL;NEL;;;;;;0.02;;
Manufacture of anhydrous ammonia;COMIS,CCA3IS;263,412;2.22;EL;;;;;;EL_NVEL_N/EL_N/EL_N/EL;0.86;;
Manufacture of plastics in primary forms;_CCM3.17,CCA317;1,919;0.02;EL;EL;;;;;;0.00;;
Electricity generation from wind power;COMa3CCA4S;2,373;0.02;EL;EL;NVEL_N/EL;;;;0.01;;
Manufacture of biogas and biofuels for use in transport and of bioliquids;COMAI3,CCA413;22,994;0.19;EL;;;;;;0.01;;
Transmission and distribution networks for renewable and low-carbon gases;COM A414, CCA414;101,849;0.86;EL;;;;;;0.00;;
Construction, extension and operation of water collection, treatment and supply systems;COMSL.CCAS1;1,069;0.01;EL;;;;;;0.02;;
Transport of CO2;CMS. CCAS.;897;0.01;EL;;;;;;0.00;;
Infrastructure for rail transport;COMBIACCABIA;34,537;0.29;EL;EL;NEL;N/EL_;NEL;;;;0.00;;
Demolition of buildings and other structures;£33;5,251;0.04;NEL_NAEL_N/EL_NEL__EL_NVEL;;;;;;
Provision of IT/OT (information technology/operational technologies);data-driven solutions;CE4l;17,851;0.15;NEL;N/EL_;NEL;;;;;;
Sale of spare parts;(E52;260;0.00;NEL;N/EL;NAL;N/EL;;;;;;
Preparation for re-use of end-of-life products and product components;CES3;155,551;1.31;NEL;N/EL_N/EL_N/EL;;;;;;
Bonifica di siti e aree contaminate;pec2a;12,339;0.10;NEL;N/EL_N/EL;;;;;;
Other CCM;559;0.00;EL;EL;N/EL;N/EL;N/EL;N/EL;0.03;;
Turnover of Taxonomy-eligible but not environmentally sustainable activities (not Taxonomy-aligned activities);(A.2);633,177;5.33;3.72;0.00;0.00;0.10;1.51;0.00;1.00;;
A. Turnover of Taxonomy-eligible activities (A.1+A.2);1,411,016;11.88;10.27;0.00;0.00;0.10;1.51;0.00;11.20;;"
