";Interest;Valuation;Payments;Fees;Other effects;Valuation;Reclassi-;Total
in million euros Financial assets measured at amortized cost;15;-30;1;-;1;-;income -;-13
Financial assets measured at fair value through other comprehensive income (debt instruments) Financial assets measured at fair value;-;-;-;-;-;0;-;0
through other comprehensive income (equity instruments);-;-;-;-;-;5;-;5
Financial assets and liabilities measured;1;-;-;-;-146;-43;119;-59
at fair value through profit or loss';-62;-;-;4;16;-;-;-50
Total net results 2022;-36;-30;1;-4;-129;-38;119;-117"
