"Fiscal 2023;2023;Substantial contribution criteria;DNSH criteria ‘ ape . (‘Does Not Significantly Harm’);;;;;
Economic activities (1);(2);(3);(4);(5);(6);(7);(8);(9);(10);(11);(12);(13);(14);(15);(16);(17);(18);(19);(20)
;€ million;%;EL;N/EL;EL;N/EL;EL;N/EL;EL;N/EL;Y;N;Y;N;Y;N;Y;N;Y;N
A.2 Taxonomy-eligible but not environmentally sustainable activities (not taxonomy-aligned);;;;;;;;;
Electricity generation from wind energy;CCM 4.3;43;2;EL;N/EL;N/EL;N/EL;N/EL;N/EL;2;N;N;N;N;N;N;N;N
Electricity generation from bioenergy;CCM 4.8;1;0;EL;N/EL;N/EL;N/EL;N/EL;N/EL;0;N;N;N;N;N;N;N;N
CHP with fossil gaseous fuels;CCM 4.30;39;2;EL;N/EL;N/EL;N/EL;N/EL;N/EL;1;N;N;N;N;N;N;N;N
CHP/CCP with bioenergy;CCM 4.20;12;1;EL;N/EL;N/EL;N/EL;N/EL;N/EL;0;N;N;N;N;N;N;N;N
Electricity generation from natural gas;CCM 4.29;201;10;EL;N/EL;N/EL;N/EL;N/EL;N/EL;9;N;N;N;N;N;N;N;N
OpEx of taxonomy-eligible but not environmentally sustainable activities (not taxonomy-aligned) (A.2);296;15;15%;-;-;-;-;-;12
OpEx of taxonomy-eligible activities (A.1+A.2);776;39;39%;-;-;-;-;-
B. NOT TAXONOMY-ELIGIBLE ACTIVITIES;;;;
OpEx of not taxonomy-eligible activities (B);;1,231;61;;;;;;;;"
