"Economic activities;Code;Operating (opex) ntosere millions of €;expenditure x %;Climate change mitigation Y,N,EL, N/EL;Climate change adaptation;Water -Y,N,EL, N/EL;Circular Pollution economy ~—Y,NEL, ~—Y,N,EL, N/EL;Climate Climate change change mitigation adaptation Y/N;Water;Pollution Y/N;Circular economy Y/N;Biodiversity Y/N;Minimum safe- guards Y/N;Taxonomy aligned (A.1.) or eligible (A.2.) _ proportion of opex 2022 %;Category enabling activity E;Category _ transitional activity
A. Taxonomy-eligible activities Po;;;;;;;;
AA. Environmentally sustainable activities (taxonomy-aligned) N/EL N/EL Y Y Y;;;;;;;
Data-driven solutions for GHG emissions reductions Opex of environmentally sustainable activities;CCM 8.2;2;0.5;Y;N/EL;N/EL;N/EL;Y;;Y;Y;Y;;0.4;E;
(taxonomy-aligned) (A.1.);;2;0.5;0.5;0.0;0.0;0.0;0.0;Y;Y;Y;Y;Y;Y;0.4;;;
of which: enabling;;2;0.5;0.5;0.0;0.0;0.0;0.0;;0.4;E;;
of which: transitional A.2. Taxonomy-eligible but not environmentally sustainable activities;;0;0.0;0.0;;;;;;0.0;;;
(not taxonomy-aligned activities) Data processing, hosting and related activities;CCM 8.1;79;19.1;EL;EL;N/EL;N/EL;;;;19.0;;;
Data-driven solutions GHG emissions reductions;CCM 8.2;56;13.6;EL;N/EL;N/EL;N/EL;;;;14.1;;;
for Product-as-a-service and other circular use- and result-oriented service models;CES.S;0;0.0;N/EL;N/EL;N/EL;N/EL;;;;0.0;;;
Transport by motorbikes, passenger cars and light commercial vehicles;CCM6.5;0;0.0;EL;EL;N/EL;N/EL;;;;0.0;;;
Infrastructure enabling low-carbon road transport and public transport;CCM 6.15;0;0.0;EL;N/EL;N/EL;N/EL;;;;0.0;;;
Opex of taxonomy-eligible but not environmentally sustainable activities (not taxonomy-aligned activities) (A.2.);;135;32.7;32.7;0.0;0.0;0.0;0.0;;33.1;;;
A. Opex of taxonomy-eligible activities (A.1. + A.2.);;137;33.2;33.2;0.0;0.0;0.0;0.0;;33.5;;;
B. Taxonomy non-eligible activities;;;;;;;;
Opex of taxonomy non-eligible activities;;276;66.8;;;;;;66.5;;;
Total;;;;413;100.0;;;;;;100.0;;;"
