"Aspects and disclosures in accordance with section 289¢ HGB;Reported topics;Reporting in sustainability chapter
Environmental Matters;Energy, Emissions;Climate & Environment
Employee-related Matters;Talent Acquisition, Employee Development and Retention, Management Development, Diversity and Equal Opportunity;Employees, Diversity & Inclusion
Social Matters;Social Responsibility (Public Value), Data Protection, Media Regulation (Journalistic Independence and Due Diligence, Programme Guidelines, Youth Protection);Society, Governance & Compliance
Respect for Human Rights;Anti-discrimination;Society
Prevention of Corruption and Bribery;Anti-corruption;Governance & Compliance
Other Aspects;Antitrust Law;Governance & Compliance"
