index,question,value,response
210,"What is the average percentage of electric and electroninc waste recycled across the years 2019, 2020, 2021, 2022 and 2023?",98.75,0.98333
211,"What is the sum of tonnes of ordinary waste produced in the years 2019, 2020, 2021, 2022 and 2023?",6238,2436.1
212,What is the difference between the total group-related direct and indirect consumption of energy in 2023?,13957,1182.0
213,What is the sum of the group-related direct and indirect consumption of energy in 2023?,14711,14761.0
214,What is the percentage reduction in the group-related total consumption of energy from 2022 to 2023?,15.24,0.0226
215,What is the difference between the full consolidated and group-level percentage usage of energy from renewable sources in 2023?,0.16,0.06
216,What is the percentage decrease in group-realted energy intensity per milion of revenue from 2021 to 2022?,19.05,-0.18154
217,What is the average total group-related direct consumption of energy in TJ for the years 2022 and 2023?,15499.5,14499.0
218,What is the reduction in total group-related indirect consumption of energy from 2022 to 2023?,319,-126.0
219,"What is the sum of full consolidated energy consumption (in TJ) for the years 2021, 2022, and 2023?",44559,43147.0
220,What is the difference in the total energy consumption when comparing the group related direct and indirect consumption of energy in 2021?,13479,1328.0
221,What is the percentage of total group-related direct consumption over the total consumption in 2022?,95.99,92.52221
222,What is the average of the total group-related direct and indirect consumption of energy for the year 2021 in TJ?,7431.5,17443.0
223,What is the percentage difference in total group-related energy consumption when comparing the direct and indirect consumption of energy in 2023?,97.37,0.44936
224,What is the average group-related total consumption of energy for the years 2023 and 2022?,16038,14488.0
225,What is the average energy consumption from renewable sources in 2023 for both group-related and consolidated values?,9.84,9.835
226,What is the percentage increase in full consolidated energy consumption from 2021 to 2023?,5.52,0.05085
227,What is the sum of full consolidated direct consumption of energy in terajoules from the years 2021 to 2023?,27417,43123.0
228,What is the percentage increase in total full consolidated indirect consumption of energy from 2021 to 2022?,3.83,0.06362
229,What is the sum of all full consolidated values of total consumption of energy in TJ from 2021 to 2023?,44559,43151.0
230,"What is the average energy consumption, including both direct and indirect full consolidated consumption, for the year 2022?",8210.5,14489.0
231,What is the difference between the total full-consolidated direct and indirect consumption of energy in 2021?,12959,1183.0
232,What is the percentage of full-consolidated indirect consumption of energy over direct consumption in 2021?,2.75,0.02444
233,What is the sum of the total full consolidated direct and indirect consumption of energy for the year 2021?,13691,17151.0
234,What is the sum of group-level thermal energy and electricity consumed from the grid in MWh for the year 2023?,40111,59320.0
235,What is the percentage reduction in group level electricity consumed from the grid when comparing the values for the year 2022 and 2023?,44.02,0.06004
236,What is the increase in the group level amount of electricity self-produced from renewable sources when comparing the values from 2021 to 2023?,85.4,19.1
237,What is the percentage decrease in the total group-level indirect consumption of energy from 2022 to 2023?,48.44623238,-0.05315
238,What is the average group-level electricity consumed from the grid in MWh for the years 2023 and 2022?,53127,36897.0
239,What is the reduction in thermal energy consumed (MWh) from 2022 to 2023 for the consolidated total?,8089,10066.0
240,What is the sum of the group level electricity cosumed from the grid and produced from renewable sources in MWh for the years 2023 and 2021?,21536,77663.0
241,How many megawatts per hour are consumed from the grid and do not come from renewable sources in 2023 (group level statistics)?,23735,1366.0
242,What is the average cosumption of energy considering the thermal energy and electricity consumed from the grid in 2023 (group level statistics)?,20055.5,10066.0
243,What is the average full consolidated electricity consumed from the grid (in MWh) over the years 2021 to 2023?,36144,36799.0
244,What is the increase in full consolidated electricity self-produced from renewable sources between the years 2021 and 2023?,85.4,19.1
245,What is the percentage decrease in the total indirect consumption of energy from 2022 to 2023 when comparing the consolidated values?,17.41914336,-0.04969
246,"What is the total electricity consumed from the grid (in MWh) across the years 2021 to 2023, considering full consolidated values?",108432,113623.0
247,What is the percentage reduction in full consolidated thermal energy consumed from 2022 to 2023?,80.35962647,0.99831
248,What is the difference in the group level amount of electricity produced from renewable sources between the years 2022 and 2021?,6766,6863.0
249,What is the average consumption of full consolidated thermal energy across the years 2023 and 2022?,6021.5,10066.0
250,"What is the average group-level location-based emissions (in kt CO2eq) for the years 2021, 2022, and 2023?",4498.933333,6383.06667
251,What is the difference in group-level market based emissions (in kt CO2eq) between the years 2023 and 2021?,3784.1,1046.3
252,What is the percentage increase in group-level market-based emissions from 2021 to 2022?,64.63716947,0.0122
253,What is the sum of the group-level market-based emissions for the years 2021 and 2023?,9108.9,12887.4
254,What is the percentage increase in group-level market-based emissions between the years 2022 and 2023?,47.06955946,0.0122
255,What is the reduction in emissions intensity 2 between the years 2021 and 2022?,31.1,0.38633
256,What is the average of full consolidated location and market based emissions in the year 2021?,2379.9,6483.45
257,What is the percentage difference between full consolidated market and location based emissions for the year 2021?,1.996755273,0.00694
258,What is the sum of the full consolidated location and market-based emissions for the year 2022?,7283,12787.2
259,What is the percentage increase in full consolidated location-based emissions from the year 2021 to the year 2022?,54.61182563,0.01297
260,What is the increase between the full consolidated market-based emissions from 2022 to 2023?,2699.7,106.5
261,What is the percentage increase in group-level market-based emissions from 2021 to 2022?,64.63716947,0.0122
262,"What is the average full consolidated market-based emissions (in kt CO2eq) for the years 2021, 2022, and 2023?",4128.2,6449.33333
263,What is the reduction in emission intensity (in kt CO2 eq/€mln) from 2022 to 2023?,37.7,38.7
264,What is the sum of the emission intensity (in kt CO2 eq/€mln) from 2021 to 2023?,369.6,258.6
265,What is the difference between full consolidated location and market based emissions in 2023?,0.1,1066.2
266,What is the maximum percentage reduction in indirect GHG emissions between two consecutive years in the range 2021-2023?,8.74,0.09802
267,What is the minimum percentage reduction in indirect GHG emissions between two consecutive years in the range 2021-2023?,2.75,-0.05063
268,How much has the percentage of European over the total of indirect GHG emissions decreased from 2023 compared to 2015?,1.594,0.18154
269,What is the minimum percentage value of European indirect GHG emissions on total indirect emissions that was recorded from 2021 to 2023?,0.491,0.47419
270,What is the difference between the percentage of emissions from petroleum products and gas for the year 2023?,0.2901,0.67254
271,What is the percentage decrease between the sum of emissions from petroleum products and gas from 2022 to 2023?,8.594,0.15271
272,What is the highest average emission value calculated on petroleum products and gas emissions from 2021 to 2023?,200,307.0
273,"What is the maximum percentage reduction in indirect emissions from Europe recorded in the years 2023, 2022 and 2021 compared to the base year 2015?",0.2539,0.09807
274,"What is the average percentage reduction in indirect emissions from Europe in the years 2023, 2022 and 2021 compared to the base year 2015?",0.1836,0.0706
275,What is the average decrease in lifecycle carbon intensity of energy products sold between two successive years in the range 2021-2023?,1.5,-0.07692
276,What is the maximum change between the sum of scope 1 + 2 emissions of operated Upstream oil & gas activities and Upstream oil & gas activities on equity basis calculated in 2023 compared to the years 2022 and 2021?,1,3.0
277,"Between 2021 and 2023, what is the largest percentage decrease between two consecutive years in scope 3 indirect emissions?",8.74,-0.19
278,By how many percentage points has the proportion of European indirect GHG emissions relative to the total decreased in 2023 compared to 2015?,1.594,-0.09524
279,"From 2019 to 2023, what is the lowest recorded percentage of European emissions compared to the total?",49.1,22.46341
280,"For 2023, how much higher is the proportion of emissions from petroleum products compared to gas?",29.01,0.58224
281,"During the period 2021 to 2023, what was the least percentage reduction in Scope 3 GHG emissions between two consecutive years?",2.75,0.09524
282,"What is the highest value of the average emissions from petroleum products and gas, calculated every year in the range 2019 - 2023?",205,389.0
283,What is the percentage decrease between the sum of emissions from petroleum products and gas from 2022 to 2023?,8.594,-0.18154
284,What is the difference between the maximum indirect emission value recorded in 2022 and 2023?,34,14.0
285,What is the difference between the average of the top-3 indirect emission values ​​recorded in 2023 and 2022?,12.67,1.0
