"Manufacture of low carbon technologies for transport Transport by motorbikes, passenger cars and light commercial vehicles;CCM 3.3; CCA 3.3;CCM 6.5; CCA 6.5;2,051;30.9;EL;EL;N/EL;N/EL;N/EL;N/EL;N/EL;N/EL;28.5;  
jpEx of Taxonomy-eligible but not environmentally sustainable activities not Taxonomy-aligned activities) (A.2;;4,572;68.9;;;N/EL;N/EL;N/EL;71.4;  
OpEx of Taxonomy-eligible activities (A.1+A.2);;6,634;100.0;;;N/EL;N/EL;N/EL;100.0;  
}. TAXONOMY-NON-ELIGIBLE ACTIVITIES;;;;;;  
jpEx of Taxonomy-non-eligible activities;;0;0.0;;;N/EL;N/EL;N/EL;  
otal;;6,634;100.0;;;N/EL;N/EL;N/EL;"
