Unnamed: 0,hierarchical,pdf name,gri,gri_finegrained,page nbr,table nbr,question,value,row,column
1358,0,['munich-re_2023.pdf'],302,302-1.3,[47],[1],What was the district heating consumption in megawatt-hour for the year 2023?,41931,8,2
1359,0,['munich-re_2023.pdf'],302,302-1.16,[47],[1],What was the district cooling consumption in megawatt-hour for the year 2023?,4283,9,2
1360,0,['munich-re_2023.pdf'],302,302-1.1,[47],[1],What was the liquid fuel consumption for emergency power in megawatt-hour for the year 2023?,872,10,2
1361,0,['munich-re_2023.pdf'],302,"302-4.2, 302-1.7",[47],[1],What is the percentage reduction in total energy consumption in 2023 compared to 2022?,-20,11,4
1362,0,['munich-re_2023.pdf'],302,"302-4.2, 302-1.2",[47],[1],What is the percentage reduction in electricity consumption in 2023 compared to 2022?,-7,6,4
1363,0,['munich-re_2023.pdf'],302,"302-4.2, 302-1.3",[47],[1],What is the percentage reduction in district heating consumption in 2023 compared to 2022?,-18.8,8,4
1364,0,['munich-re_2023.pdf'],302,"302-4.2, 302-1.16",[47],[1],What is the percentage reduction in district cooling consumption in 2023 compared to 2022? ,-20.3,9,4
1365,0,['munich-re_2023.pdf'],302,"302-4.2, 302-1.1",[47],[1],What is the percentage reduction in liquid fuel consumption for emergency power compared to the previous year?,-18.4,10,4
1366,0,['munich-re_2023.pdf'],303,303-5.1,[47],[0],What was the total amount of water used in 2023 in m3?,432730,3,3
1367,0,['munich-re_2023.pdf'],303,303-5.1,[47],[0],How much water was used per employee in 2022 in m3/Headcount?,12,4,4
1368,0,['munich-re_2023.pdf'],303,"303-3.6, 303-3.7",[47],[0],What was the water intensity in 2022 in m3/€m insurance revenue?,9,5,4
1369,0,['munich-re_2023.pdf'],305,305-1.1,[46],[0],What were the gross direct GHG emissions (Scope 1) in tonnes of CO2 equivalent for the year 2023?,33093,3,3
1370,0,['munich-re_2023.pdf'],305,305-2.3,[46],[0],How much were the gross indirect GHG emissions from energy consumption (Scope 2) in tonnes of CO2 equivalent for the year 2023?,14249,5,3
1371,0,['munich-re_2023.pdf'],305,305-3.1,[46],[0],What is the total gross other indirect GHG emissions (Scope 3) in tonnes of CO2 equivalent for the year 2023?,3039435,6,3
1372,0,['munich-re_2023.pdf'],305,"305-1.1, 305-3.1, 305-2.2",[46],[0],What were the total GHG emissions for scope 1-3 (own operations) and scope 2 (market-based) in tonnes of CO₂ equivalent for the year 2023?,69913,14,3
1373,0,['munich-re_2023.pdf'],305,"305-1.1, 305-3.1, 305-2.2",[46],[0],What is the total t CO₂ equivalent of GHG emissions for scope 1-3 and scope 2 (market-based) in 2023?,3086777,15,3
1374,1,['munich-re_2023.pdf'],305,305-1.1,[46],[1],What is the amount of gross direct GHG emissions (Scope 1) in tonnes of CO2 equivalent per employee for the year 2023?,0.77,4,3
1375,1,['munich-re_2023.pdf'],305,305-2.2,[46],[1],How much were the gross indirect GHG emissions from energy consumption (Scope 2) market-based in tonnes of CO2 equivalent per employee for the year 2023?,0.33,6,3
1376,1,['munich-re_2023.pdf'],305,"305-1.1, 305-3.1, 305-2.2",[46],[1],"What is the total GHG emissions, scope 1-3 own operations, scope 2 market based in tonnes of CO2 equivalent per employee for the year 2023?",1.63,12,3
1377,1,['munich-re_2023.pdf'],305,305-2.1,[46],[1],What was the amount of gross indirect GHG emissions from energy consumption (Scope 2) location-based in tonnes of CO2 equivalent per employee for the previous year?,0.44,6,4
1378,1,['munich-re_2023.pdf'],305,305-3.1,[46],[1],How much did the gross other indirect GHG emissions (Scope 3) amount to in tonnes of CO2 equivalent per employee for the year 2023?,0.53,7,3
1379,1,['munich-re_2023.pdf'],305,305-*.1,[46],[1],What were the direct GHG emissions in tonnes of CO2 equivalent per insurance revenue for the year 2023?,0.57,4,8
1380,0,['munich-re_2023.pdf'],305,305-*.1,[29],[0],"What is the total financed GHG emissions from listed equities, corporate bonds, and direct real estate for the year 2023, in tonnes of CO2 equivalent?",3016864,2,2
1381,0,['munich-re_2023.pdf'],305,305-*.1,[29],[0],"What were the financed GHG emissions from listed equities and corporate bonds in the thermal coal segment for the year 2023, in tonnes of CO2 equivalent?",234194,3,2
1382,0,['munich-re_2023.pdf'],305,305-*.1,[29],[0],What is the total for listed equities and corporate bonds from companies in the oil & gas segment for the 2023 in tonnes of CO2 equivalent?,463260,4,2
1383,0,['munich-re_2023.pdf'],305,305-*.1,[29],[0],"What is the total financed GHG emissions from listed equities, corporate bonds, and direct real estate in the previous year, in tonnes of CO2 equivalent?",3113093,2,3
1384,0,['munich-re_2023.pdf'],305,305-*.1,[29],[0],"What were the financed GHG emissions from listed equities and corporate bonds in the thermal coal segment in the previous year, in tonnes of CO2 equivalent?",269179,3,3
1385,0,['munich-re_2023.pdf'],305,305-*.1,[29],[0],What is the total for listed equities and corporate bonds from companies in the oil & gas segment in the previous year in tonnes of CO2 equivalent?,734197,4,3
1386,0,['munich-re_2023.pdf'],305,305-*.1,[29],[1],"What was the percentage change for financed GHG emissions from listed equities, corporate bonds and direct real estate in 2023?",-42.7,2,2
1387,0,['munich-re_2023.pdf'],305,305-*.1,[29],[1],What was the percentage change for financed GHG emissions from listed equities and corporate bonds from companies in the thermal coal segment in 2023?,64.3,3,2
1388,0,['munich-re_2023.pdf'],305,305-*.1,[29],[1],What was the percentage change for financed GHG emissions from listed equities and corporate bonds from companies in the oil & gas segment in 2023?,-55.1,4,2
1389,0,['munich-re_2023.pdf'],305,305-*.1,[29],[1],"What was the percentage change for financed GHG emissions from listed equities, corporate bonds and direct real estate in the previous year?",-45.7,2,3
1390,0,['munich-re_2023.pdf'],305,305-*.1,[29],[1],What was the percentage change for financed GHG emissions from listed equities and corporate bonds from companies in the thermal coal segment in the previous year?,-47.5,3,3
1391,0,['munich-re_2023.pdf'],305,305-*.1,[29],[1],What was the percentage change for financed GHG emissions from listed equities and corporate bonds from companies in the oil & gas segment in the previous year?,-28.9,4,3
1392,1,['OTC_SAPMY_2023.pdf'],302,302-1.7,[144],[0],What was the total direct consumption of energy in 2023 for the entire group in TJ?,14334,3,3
1393,1,['OTC_SAPMY_2023.pdf'],302,302-2.1,[144],[0],What was the total indirect consumption of energy in 2023 for the entire group in TJ?,377,4,3
1394,1,['OTC_SAPMY_2023.pdf'],302,302-1.7,[144],[0],What was the total consumption of energy in 2023 for the entire group in TJ?,14715,5,3
1395,1,['OTC_SAPMY_2023.pdf'],302,302-1.8,[144],[0],What percentage of energy for the entire group came from renewable sources in 2023?,9.76,6,3
1396,1,['OTC_SAPMY_2023.pdf'],302,302-3.1,[144],[0],What was the energy intensity for the entire group in 2021 in TJ/€mln?,2.1,7,7
1397,1,['OTC_SAPMY_2023.pdf'],302,302-1.7,[144],[0],What was the total direct consumption of energy in 2022 for the entire group in TJ?,16665,3,5
1398,1,['OTC_SAPMY_2023.pdf'],302,302-2.1,[144],[0],What was the total indirect consumption of energy for the entire group in 2022 in TJ?,696,4,5
1399,1,['OTC_SAPMY_2023.pdf'],302,302-1.7,[144],[0],What was the total consumption of energy for the entire group in 2022 in TJ?,17361,5,5
1400,1,['OTC_SAPMY_2023.pdf'],302,302-2.1,[144],[0],What was the energy intensity for the entire group in 2022 in TJ/€mln?,1.7,7,5
1401,1,['OTC_SAPMY_2023.pdf'],302,302-1.7,[144],[0],What was the total direct consumption of energy for the entire group in 2021 in TJ?,14171,3,7
1402,1,['OTC_SAPMY_2023.pdf'],302,302-2.1,[144],[0],What was the total indirect consumption of energy for the entire group in 2021 in TJ?,692,4,7
1403,1,['OTC_SAPMY_2023.pdf'],302,302-1.7,[144],[0],What was the total consumption of energy for the entire group in 2021 in TJ?,14863,5,7
1404,1,['OTC_SAPMY_2023.pdf'],302,302-3.1,[144],[0],What was the energy intensity for the entire group in 2023 in TJ/€mln?,1.2,7,3
1405,1,['OTC_SAPMY_2023.pdf'],302,302-2.1,[145],[0],What was the total indirect consumption of energy for the entire group in MWh for the year 2023?,40496,3,3
1406,1,['OTC_SAPMY_2023.pdf'],302,302-1.2,[145],[0],How much electricity was consumed from the grid for the entire group in MWh in 2022?,68120,4,5
1407,1,['OTC_SAPMY_2023.pdf'],302,302-1.8,[145],[0],What is the amount of electricity self-produced from renewable sources for the entire group in MWh for the year 2021?,298.9,7,7
1408,1,['OTC_SAPMY_2023.pdf'],302,302-2.1,[145],[0],What was the total indirect consumption of energy for the entire group in MWh for the year 2022?,78551,3,5
1409,1,['OTC_SAPMY_2023.pdf'],302,302-1.2,[145],[0],How much electricity was consumed from the grid for the entire group in MWh in 2023?,38134,4,3
1410,1,['OTC_SAPMY_2023.pdf'],302,302-1.3,[145],[0],What was the amount of thermal energy consumed from the entire group in MWh for the year 2022?,10066,6,5
1411,1,['OTC_SAPMY_2023.pdf'],302,302-1.2,[145],[0],What was the amount of electricity consumed from renewable sources for the entire group in MWh for the year 2023?,14399,5,3
1412,1,['OTC_SAPMY_2023.pdf'],302,302-1.3,[145],[0],How much thermal energy was consumed from the entire group in MWh for the year 2021?,-,6,7
1413,1,['OTC_SAPMY_2023.pdf'],302,302-1.2,[145],[0],What was the amount of electricity self-produced from renewable sources for the entire group in MWh for the year 2022?,365.2,7,5
1414,1,['OTC_SAPMY_2023.pdf'],303,303-5.6,[152],[0],What was the amount of recycled and re-used water in 2023 in thousands of cubic meters for the entire group?,183,3,3
1415,1,['OTC_SAPMY_2023.pdf'],303,303-5.6,[152],[0],How much recycled and re-used water was reported in 2022 in thousands of cubic meters for the entire group?,298,3,5
1416,1,['OTC_SAPMY_2023.pdf'],303,303-5.6,[152],[0],What is the amount of recycled and re-used water in 2021 in thousands of cubic meters for the entire group?,447.8,3,7
1417,1,['OTC_SAPMY_2023.pdf'],303,303-5.6,[152],[0],What percentage of water was re-used in 2023 for the entire group?,5,4,3
1418,1,['OTC_SAPMY_2023.pdf'],303,303-5.6,[152],[0],What was the re-used water percentage in 2022 for the entire group?,6,4,5
1419,1,['OTC_SAPMY_2023.pdf'],303,303-5.6,[152],[0],What was the percentage of re-used water in 2021  for the entire group?,11,4,7
1420,1,['OTC_SAPMY_2023.pdf'],303,303-4.8,[152],[1],What was the total water discharged in 2023 in thousands of cubic meters for the entire group?,1656,4,2
1421,1,['OTC_SAPMY_2023.pdf'],303,303-4.8,[152],[1],How much water was discharged into the sewer systems in 2023 in thousands of cubic meters for the entire group?,189,5,2
1422,1,['OTC_SAPMY_2023.pdf'],303,303-4.4,[152],[1],What is the volume of water discharged into bodies of surface water in 2021 in thousands of cubic meters for the entire group?,919,6,6
1423,1,['OTC_SAPMY_2023.pdf'],303,303-4.4,[152],[1],What was the total water discharged into the sea in 2023 in thousands of cubic meters for the entire group?,1019,7,2
1424,1,['OTC_SAPMY_2023.pdf'],303,303-4.4,[152],[1],How much water was discharged into bodies of surface water in 2022 in thousands of cubic meters for the entire group?,1090,6,4
1425,1,['OTC_SAPMY_2023.pdf'],303,303-4.4,[152],[1],What was the total water discharged into the sea in 2021 in thousands of cubic meters for the entire group?,1143,7,6
1426,1,['OTC_SAPMY_2023.pdf'],303,303-4.8,[153],[0],What was the total volume of water discharged in 2023 for the entire group in 10^3 m3?,333.1,3,2
1427,1,['OTC_SAPMY_2023.pdf'],303,303-4.8,[153],[0],How much was the total water discharged in 2022 for the entire group in 10^3 m3?,401,3,4
1428,1,['OTC_SAPMY_2023.pdf'],305,"305-1.1, 305-2.1, 305-3.2",[147],[0],"What was the total location-based Scope 1, 2 and 3 emissions in 2023 in kilotonnes of CO2 equivalent for the entire group?",6446.7,4,3
1429,1,['OTC_SAPMY_2023.pdf'],305,"305-1.1, 305-2.1, 305-3.2",[147],[0],"What were the total location-based Scope 1, 2 and 3 emissions in 2022 in kilotonnes of CO2 equivalent for the entire group?",4385.6,4,5
1430,1,['OTC_SAPMY_2023.pdf'],305,"305-1.1, 305-2.1, 305-3.2",[147],[0],"What were the total location-based Scope 1, 2 and 3 emissions in 2021 in kilotonnes of CO2 equivalent for the entire group?",2664.5,4,7
1431,1,['OTC_SAPMY_2023.pdf'],305,"305-1.1, 305-2.2, 305-3.3",[147],[0],"What was the total market-based Scope 1, 2 and 3 emissions in 2023 in kilotonnes of CO2 equivalent for the entire group?",6446.5,6,3
1432,1,['OTC_SAPMY_2023.pdf'],305,"305-1.1, 305-2.2, 305-3.3",[147],[0],"What were the total market-based Scope 1, 2 and 3 emissions in 2022 in kilotonnes of CO2 equivalent for the entire group?",4383.3,6,5
1433,1,['OTC_SAPMY_2023.pdf'],305,"305-1.1, 305-2.2, 305-3.3",[147],[0],"What were the total market-based Scope 1, 2 and 3 emissions in 2021 in kilotonnes of CO2 equivalent for the entire group?",2662.4,6,7
1434,1,['OTC_SAPMY_2023.pdf'],305,"305-4.1, 305-1.1, 305-2.2",[147],[0],What was the emission intensity for market-based Scope 1 and 2 in 2023 in kilotonnes of CO2 equivalent per million euros for the entire group?,87.7,8,3
1435,1,['OTC_SAPMY_2023.pdf'],305,"305-4.1, 305-1.1, 305-2.2",[147],[0],What was the emission intensity for market-based Scope 1 and 2 in 2022 in kilotonnes of CO2 equivalent per million euros for the entire group?,125.4,8,5
1436,1,['OTC_SAPMY_2023.pdf'],305,"305-4.1, 305-1.1, 305-2.2",[147],[0],What was the emission intensity for market-based Scope 1 and 2 in 2021 in kilotonnes of CO2 equivalent per million euros for the entire group?,156.5,8,7
1437,0,['OTC_SAPMY_2023.pdf'],305,"305-3.1, 305-*.2",[147],[1],"What was the total GHG emissions from Scope 3 related to purchased goods and services in 2023, measured in kilotonnes of CO2 equivalent?",4744,2,2
1438,0,['OTC_SAPMY_2023.pdf'],305,"305-*.1, 305-*.2",[147],[1],How much were the GHG emissions related to purchased goods and services in 2022 in kilotonnes of CO2 equivalent?,2440,2,4
1439,0,['OTC_SAPMY_2023.pdf'],305,"305-*.1, 305-*.2",[147],[1],What is the value for GHG emissions associated to fuel and energy related activities in 2023 in kilotonnes of CO2?,241,3,2
1440,0,['OTC_SAPMY_2023.pdf'],305,"305-*.1, 305-*.2",[147],[1],What was the amount of GHG emissions for fuel and energy related activities in 2022 in kilotonnes of CO2?,296,3,4
1441,0,['OTC_SAPMY_2023.pdf'],305,"305-*.1, 305-*.2",[147],[1],What was the value of GHG emissions for leased assets in 2023 in kilotonnes of CO2?,260,4,2
1442,0,['OTC_SAPMY_2023.pdf'],305,"305-*.1, 305-*.2",[147],[1],How much were the GHG emissions for leased assets in 2022 in kilotonnes of CO2?,233,4,4
1443,0,['OTC_SAPMY_2023.pdf'],305,"305-*.1, 305-*.2",[147],[1],"What was the total amount of GHG emissions associated with waste generated in operations in 2023, measured in kilotonnes of CO2 equivalent?",53,5,2
1444,0,['OTC_SAPMY_2023.pdf'],305,"305-*.1, 305-*.2",[147],[1],"What was the total amount of GHG emissions associated with waste generated in operations in 2022, measured in kilotonnes of CO2 equivalent?",59,5,4
1445,0,['OTC_SAPMY_2023.pdf'],305,"305-*.1, 305-*.2",[147],[1],What is the total GHG emissions for upstream transportation and distribution in 2023 in kilotonnes of CO2?,35,6,2
1446,0,['OTC_SAPMY_2023.pdf'],305,"305-*.1, 305-*.2",[147],[1],What were the GHG emissions upstream transportation and distribution amount in 2022 in kilotonnes of CO2?,45,6,4
1447,0,['OTC_SAPMY_2023.pdf'],305,"305-*.1, 305-*.2",[147],[1],How many GHG emissions were generated for business travels in 2023 in kilotonnes of CO2?,63,7,2
1448,0,['OTC_SAPMY_2023.pdf'],305,"305-*.1, 305-*.2",[147],[1],What were the GHG emissions related to business travels in 2022 in kilotonnes of CO2?,48,7,4
1449,0,['OTC_SAPMY_2023.pdf'],305,"305-5.1, 305-*.1",[147],[2],"What was the GHG emissions savings goal in 2023, measured in kilotonnes of CO2 equivalent?",38.2,2,2
1450,0,['OTC_SAPMY_2023.pdf'],305,"305-5.1, 305-*.1",[147],[2],"How much GHG emissions savings were achieved in 2023, measured in kilotonnes of CO2 equivalent?",47,2,3
1451,0,['OTC_SAPMY_2023.pdf'],305,"305-5.1, 305-*.1",[147],[2],"What was the GHG emissions savings goal in 2022, measured in kilotonnes of CO2 equivalent?",36.3,3,2
1452,0,['OTC_SAPMY_2023.pdf'],305,"305-5.1, 305-*.1",[147],[2],"How much GHG emissions savings were achieved in 2022, measured in kilotonnes of CO2 equivalent?",38.19,3,3
1453,0,['OTC_SAPMY_2023.pdf'],305,"305-5.1, 305-*.1",[147],[2],"What was the GHG emissions savings goal in 2021, measured in kilotonnes of CO2 equivalent?",36.5,4,2
1454,0,['OTC_SAPMY_2023.pdf'],305,"305-5.1, 305-*.1",[147],[2],"How much GHG emissions savings were achieved in 2021, measured in kilotonnes of CO2 equivalent?",36.98,4,3
1455,0,['OTC_SAPMY_2023.pdf'],305,"305-5.1, 305-*.1",[147],[2],"What was the GHG emissions savings goal in 2020, measured in kilotonnes of CO2 equivalent?",17.8,5,2
1456,0,['OTC_SAPMY_2023.pdf'],305,"305-5.1, 305-*.1",[147],[2],"How much GHG emissions savings were achieved in 2020, measured in kilotonnes of CO2 equivalent?",26.69,5,3
1457,0,['OTC_SAPMY_2023.pdf'],305,305-7.1,[148],[0],How much NOx was emitted in 2023 with reference to the entire group in tonnes?,11275,3,2
1458,0,['OTC_SAPMY_2023.pdf'],305,305-7.2,[148],[0],How much SO2 was emitted in 2022 with reference to the entire group in tonnes?,607,4,4
1459,0,['OTC_SAPMY_2023.pdf'],305,305-*.1,[148],[0],What was the level of CO emissions in 2021 with reference to the entire group in tonnes?,5231,5,6
1460,0,['OTC_SAPMY_2023.pdf'],305,305-7.4,[148],[0],What is the amount of NMVOC emissions in tonnes recorded in 2023 with reference to the entire group?,815,6,2
1461,0,['OTC_SAPMY_2023.pdf'],305,305-7.6,[148],[0],What was the emission of PM10 in tonnes in 2022 with reference to the full consolidated group?,550,7,5
1462,0,['OTC_SAPMY_2023.pdf'],305,"305-7.1, 305-5.1",[148],[1],"What amount of avoided NOx emissions for the entire group was achieved in 2023, measured in tonnes?",475.3,3,2
1463,0,['OTC_SAPMY_2023.pdf'],305,"305-7.2, 305-5.1",[148],[1],"How much avoided SOx emissions for the entire group were achieved in 2023, measured in tonnes?",18.4,4,2
1464,0,['OTC_SAPMY_2023.pdf'],305,"305-*.1, 305-5.1",[148],[1],"What is the value of avoided CO emissions for the entire group in 2022, measured in tonnes?",146.5,5,4
1465,0,['OTC_SAPMY_2023.pdf'],305,"305-7.4, 305-5.1",[148],[1],"What were the avoided NMVOC emissions for the entire group in 2021, measured in tonnes?",24.2,6,6
1466,0,['OTC_SAPMY_2023.pdf'],305,"305-7.6, 305-5.1",[148],[1],"What was the amount of avoided PM10 emissions for the entire group in 2022, measured in tonnes?",13.9,7,4
1467,0,['OTC_SAPMY_2023.pdf'],306,306-3.1,[154],[0],What is the total weight of waste produced in 2023 in kilotons with reference to the entire group?,790.2,3,2
1468,0,['OTC_SAPMY_2023.pdf'],306,"306-3.2, 306-5.2",[154],[0],How much hazardous waste was disposed of in landfill sites in 2022 in kilotons with reference to the entire group?,19.2,4,4
1469,0,['OTC_SAPMY_2023.pdf'],306,"306-3.2, 306-5.2",[154],[0],What is the weight of hazardous waste that was incinerated externally in 2021 in kilotons with reference to the entire group?,2,5,6
1470,0,['OTC_SAPMY_2023.pdf'],306,"306-3.2, 306-4.2",[154],[0],How much hazardous waste was recycled in 2023 in kilotons with reference to the entire group?,1.4,7,2
1471,0,['OTC_SAPMY_2023.pdf'],306,"306-3.2, 306-5.2",[154],[0],What is the total weight of hazardous waste disposed of in other structures in 2022 in kilotons with reference to the entire group?,97.4,8,4
1472,0,['OTC_SAPMY_2023.pdf'],306,"306-3.3, 306-5.2",[154],[0],How much non-hazardous waste was disposed of in landfill sites in 2023 in kilotons with reference to the entire group?,139.8,9,2
1473,0,['OTC_SAPMY_2023.pdf'],306,"306-3.3, 306-5.2",[154],[0],What is the weight of non-hazardous waste incinerated in external plants in 2022 in kilotons with reference to the entire group?,0.05,10,4
1474,0,['OTC_SAPMY_2023.pdf'],306,"306-3.3, 306-5.2",[154],[0],How much non-hazardous waste was incinerated in Saipem plants in 2021 in kilotons with reference to the entire group?,17,11,6
1475,0,['OTC_SAPMY_2023.pdf'],306,"306-3.3, 306-4.2",[154],[0],What is the total weight of recycled non-hazardous waste in 2023 in kilotons with reference to the entire group?,52.8,12,2
1476,0,['OTC_SAPMY_2023.pdf'],306,"306-3.3, 306-5.2",[154],[0],How much non-hazardous waste was disposed of in other structures in 2022 in kilotons with reference to the entire group?,337.1,13,4
1477,0,['OTC_SAPMY_2023.pdf'],308,308-1.1,[162],[0],How many new vendors were assessed on human and labour rights breaches in 2023?,431,12,3
1478,0,['OTC_SAPMY_2023.pdf'],308,308-1.1,[162],[0],What was the total number of vendors assessed on HSE issues in 2022?,578,14,4
1479,0,['OTC_SAPMY_2023.pdf'],308,308-1.1,[162],[0],What percentage of vendors qualified in the year for activities considered at HSE risk was recorded in 2021?,9,13,5
1480,0,['OTC_SAPMY_2023.pdf'],308,308-1.1,[162],[0],How many vendors were qualified during the year in 2023?,6364,3,3
1481,0,['OTC_SAPMY_2023.pdf'],308,308-1.1,[162],[0],What number of vendors with existing contracts was reported in 2023?,10897,4,3
1482,0,['OTC_SAPMY_2023.pdf'],308,308-1.1,[162],[0],How many vendors with existing contracts classified as at risk on HSE issues were there in 2023?,1500,6,3
1483,0,['OTC_SAPMY_2023.pdf'],308,308-1.1,[162],[0],What was the number of critical vendors in 2023?,11851,7,3
1484,0,['OTC_SAPMY_2023.pdf'],308,308-1.1,[162],[0],What percentage of orders were made from critical vendors in 2023?,75,8,3
1485,0,['OTC_SAPMY_2023.pdf'],308,308-1.1,[162],[0],How many vendors qualified in the year working in countries with a high risk of human and labour rights breaches were there in 2022?,2807,9,4
1486,0,['OTC_SAPMY_2023.pdf'],308,308-1.1,[162],[0],What was the number of vendors qualified in the year for non-critical qualifications in 2023?,2447,11,3
1487,0,['Lufthansa_2023.pdf'],305,"305-*.1, 305-5.1",[288],[1],What was the percentage reduction in CO2 emissions for the year 2020?,13.76,2,2
1488,0,['Lufthansa_2023.pdf'],305,"305-*.1, 305-5.1",[288],[1],How did the CO2 emissions reduction in 2021 compare to the target achievement for that year (%)?,200,3,3
1489,0,['Lufthansa_2023.pdf'],305,"305-*.1, 305-5.1",[288],[1],What was the percentage reduction in CO2 emissions for the year 2022?,-11.41,4,2
1490,0,['Lufthansa_2023.pdf'],305,"305-*.1, 305-5.1",[288],[1],How did the CO2 emissions reduction in 2023 compare to the target achievement for that year (%)?,110.67,5,3
1491,0,['vivendi_2023.pdf'],302,302-1.2,[141],[0],What was the total electricity consumption in MWh for the year 2023?,79560,5,4
1492,0,['vivendi_2023.pdf'],302,302-1.2,[141],[0],How much electricity was consumed from renewable sources in MWh during 2023?,44811,3,4
1493,0,['vivendi_2023.pdf'],302,302-1.10,[141],[0],What was the consumption of natural gas in megawatt-hours based on gross calorific value for the year 2023?,4269,6,4
1494,0,['vivendi_2023.pdf'],302,"302-1.7, 302-1.6",[141],[0],What was the total energy consumption for buildings excluding electricity in MWh for 2023?,11676,10,4
1495,0,['vivendi_2023.pdf'],302,"302-1.1, 302-1.6",[141],[0],How much fuel was consumed for the vehicle fleet in megawatt-hours based on gross calorific value in 2023?,17978,11,4
1496,0,['vivendi_2023.pdf'],302,"302-1.7, 302-1.6",[141],[0],What was the total energy consumption for the vehicle fleet in megawatt-hours based on gross calorific value for the year 2023?,32540,15,4
1497,0,['vivendi_2023.pdf'],302,"302-1.7, 302-1.6",[141],[0],What was the total energy consumption for generators in megawatt-hours based on gross calorific value for the year 2023?,3564,18,4
1498,0,['vivendi_2023.pdf'],302,302-1.7,[141],[0],What was the total energy consumption in MWh for the organization in 2023?,127340,19,4
1499,0,['vivendi_2023.pdf'],305,305-1.1,[142],[0],What was the total Scope 1 gross direct GHG emissions in tonnes of CO2 equivalent for the year 2023?,10291,6,4
1500,0,['vivendi_2023.pdf'],305,305-2.2,[142],[0],How many tonnes of CO2 equivalent were emitted from Scope 2 electricity market-based in 2023?,12957,7,4
1501,0,['vivendi_2023.pdf'],305,305-2.1,[142],[0],What is the total Scope 2 location-based gross indirect GHG emissions in tonnes of CO2 equivalent for 2023?,22042,12,4
1502,0,['vivendi_2023.pdf'],305,305-3.1,[142],[0],What was the total Partial Scope 3 emissions in tonnes of CO2 equivalent for the year 2023?,735018,26,4
1503,0,['vivendi_2023.pdf'],305,"305-1.1, 305-2.2, 305-3.1",[142],[0],What is the total Scopes 1 and 2 market-based and partial Scope 3 emissions in tonnes of CO2 equivalent for 2023?,759530,28,4
1504,0,['vivendi_2023.pdf'],305,"305-*.1, 305-*.2",[142],[0],What was the amount of GHG emissions from business travel in tonnes of CO2 equivalent for 2023?,20012,20,4
1505,0,['vivendi_2023.pdf'],305,"305-*.1, 305-*.2",[142],[0],How many tonnes of CO2 equivalent were associated with employee commuting in 2023?,18379,21,4
1506,0,['vivendi_2023.pdf'],305,"305-*.1, 305-*.2",[142],[0],What was the total emissions from purchases of raw materials in tonnes of CO2 equivalent for 2023?,29189,15,4
1507,0,['vivendi_2023.pdf'],305,"305-*.1, 305-*.2",[142],[0],What was the total emissions from waste in tonnes of CO2 equivalent for 2023?,2772,19,4
1508,0,['vivendi_2023.pdf'],305,"305-*.1, 305-*.2",[142],[0],What was the GHG emissions from refrigerants in tonnes of CO2 equivalent for the year 2023?,1065,5,4
1509,0,['vivendi_2023.pdf'],305,305-1.1,[105],[0],What is the amount of gross direct GHG emissions (Scope 1) in tonnes of CO2 equivalent for the year 2023?,10291,2,2
